{"$id":"https://scandal-season.example/schemas/characters.schema.json","$schema":"https://json-schema.org/draft/2020-12/schema","description":"Canon character roster. Roles follow the locked roster tags (rival / suitor / villain / Gazette / ally / neutral). arc_notes carry per-season arc guidance; never invent new canon entries without Beth.","items":{"additionalProperties":false,"properties":{"arc_notes":{"type":"string"},"description":{"type":"string"},"id":{"pattern":"^[a-z0-9-]+$","type":"string"},"name":{"minLength":1,"type":"string"},"role":{"minLength":1,"type":"string"}},"required":["id","name","role"],"type":"object"},"title":"Characters","type":"array"}